Text,Category
"CS @Amb_A_Mohammed: The PBF has been effective in sustaining peace as exemplified in Burundi, Sri Lanka and Liberia #UNGA",UNRELATED
South Korean E-Mart stores to sell Kenya’s coffee,UNRELATED
"CS @AMB_A_Mohammed: Held a briefing session at the Kenya Embassy in Luanda, Angola, this morning",UNRELATED
"PS @AmbMKamau, PS Prof. Micheni Ntiba, Amb @ThomsonFiji, Amb. @Portugal_UN and Ms @LuisaFragoso2 held the 6th informal advisory commitee meeting of the UN2020 Ocean Conference to receive updates on logistics and level of preparations ahead of the Summit in June #SaveOurOcean",UNRELATED
"CS @AMB_A_Mohammed: Held talks with AU Special Representative for Somalia &amp; head of Amisom, Amb. Francisco Madeira",RECEIVE
CS @AMB_A_Mohammed:  Framework Agreement on Strengthening Cooperation in Production Capacity between Kenya and China was signed.,UNRELATED
@amb_a_mohammed: We enlist support of Iranian Govt in fighting Al-Shabaab insurgents who continue to be a threat to peace in the region.9/10,UNRELATED
"CS Amb Raychelle Omamo held bilateral talks with H.E Mevlüt Çavuşoğlu,Foreign minister of Turkey on the margins of the Antalya Diplomacy Forum. They discussed enhancing trade between the two countries within the Big Four Agenda mainly in Health, Agriculture, and Education sectors",AWAY
Cabinet Secretary Amb Raychelle Omamo today in Mombasa hosted a luncheon in honour of visiting Republic of Ireland Foreign Minister Simon Coveney.,RECEIVE
"CAS Hon. Ababu Namwamba  presents a gift to outgoing Indian High Commissioner to Kenya, H.E Mrs Suchitra  Durai,during a farewell luncheon  in her honour, hosted by the Ministry of Foreign Affairs.",UNRELATED
PS @Karanjakibicho today met Morocco Ambassador to Kenya Mr. Abdelilah Benryane for consultation in his office.,UNRELATED
For Kenyans in South Africa ,UNRELATED
CS @AMB_A_Mohammed: Dr. Abdusalam &amp; I signed a Joint Commission for Cooperation between Kenya &amp; Somalia,UNRELATED
The two Ministers of Foreign Affairs recalled the historical ties between Kenya and Morocco dating from the close personal ties between President Jomo Kenyatta and King Hassan II.  They reiterated the need to expand the relations on areas of mutual consensus #AfCFTA,UNRELATED
"At the occasion attended by Hon. John Mulimba, Uganda's Minister of State for Regional Cooperation, CAS lauded the excellent relations between 🇰🇪 &amp; 🇺🇬 founded on historical linkages, strong bonds of friendships, shared values, and common aspirations for socio-economic prosperity.",UNRELATED
"CS @AMB_A_Mohammed: Met Minister Rt. Hon. Greg Hands, United Kingdom's Minister of State in the Department for International Trade, on the sidelines of the ongoing World Trade Organization (WTO) 11th Ministerial Conference (MC11) currently taking place in Buenos Aires, Argentina.",UNRELATED
H.E. @UKenyatta is in Uganda for 3-day State Visit &amp; has already held bilateral talks with his host @KagutaMuseveni,AWAY
"@bartouvry ""Kenya-Belgium enjoy good relations, will continue coop in areas of mutual interest like marine research""",UNRELATED
"Hon. Rear Admiral Khaled Iqbal, Vice Chancellor ndu,psc. Vice-Chancellor BSMR Maritime University of Bangladesh delivers the People’s Republic of Bangladesh’s statement of commitment to the Sustainable #BlueEconomyKE @ForeignOfficeKE @BlueEconomy2018 @FishOceansCAN @JapanGov",UNRELATED
"PS @ForeignOfficeKE, @AmbMKamau held talks with Millennium Challenge Corporation Chief Executive Officer, Mr Sean Cairncross, @MCC_CEO to discussed programs aimed at increasing partnership on economic growth, private investment and good governance. Sean will also visit Mozambique",UNRELATED
Hon. Chrystia Freeland reaffirmed Canada's support and participation as co-host of Sustainable Blue Economy Conference and lauded Kenya for taking a lead in environmental and maritime protection. @BlueEconomy2018,UNRELATED
"CS #MonicaJuma, today held bilateral talks with Hon. Tilak Marapana, Sri Lankan Foreign Minister who is on official visit to Kenya. They discussed strengthening bilateral relations, education and scholarships, trade and sports especially Crickets and athletics.",RECEIVE
Ambassadors bid farewell to outgoing Iraqi Amb. H.E Mohammed Said Al-Shakarchi at luncheon hosted by the Ministry.,UNRELATED
"CS @AMB_A_Mohammed: With PS Monica Juma at Jomo Kenyatta International Airport, Nairobi, receiving Ugandan President H.E. Yoweri Kaguta Museveni on arrival for one-day official visit.",RECEIVE
@UKenyatta: Our relationship with China is a partnership I want to see increased &amp; cemented to bring mutual benefits.,UNRELATED
"@ForeignOfficeKE CS Amb Raychelle Omamo today hosted a farewell ceremony for the outgoing  Ambassador of the Hashemite Kingdom of Jordan H.E Dr.Slaiman Arabiat. Wishing him well, the CS thanked the Ambassador for strengthening bilateral and multilateral relations between 🇰🇪and🇯🇴",UNRELATED
"Kenya and Sweden have many shared priorities, especially in the area of trade and investment, gender, agriculture, water and sanitation, urban development, health, energy, environment, climate, oceans and global equitable access to vaccines.",UNRELATED
"Amb. Sarah J. C. Serem, CBS, last evening presented her letters of credence to H.E. President Xi Jinping of the People’s Republic of China at the Great Hall of the People in Beijing",UNRELATED
The signing ceremony of DRC accession treaty was witnessed by H.E Yoweri Museveni President of Uganda and H.E Paul Kagame of Rwanda. The Heads of State and Government thereafter unveiled the new map of the East African Community.,UNRELATED
"Tanzania to patent its coffee for protection, higher quality ",UNRELATED
"Kenya woos Japanese investors

Kenya has urged Japanese investors to take advantage of opportunities in the...",UNRELATED
"""The regional market is ripe, there is no reason whatsoever why DRC should get meat from Brazil when there is enough here"" @Karanjakibicho",UNRELATED
CS @AMB_A_Mohammed: Relations between Mali &amp; Kenya are warm &amp; cordial.,UNRELATED
"Somalia reopens Embassy in Nairobi. Full story on link below.
",UNRELATED
We were honoured with a visit to the Jose`  Marti` a Cuban hero and patriot memorial park.,UNRELATED
CS @AMB_A_Mohammed: Kenya &amp; Israel have agreed to extend the small-holder irrigation program in Kenya,UNRELATED
CS @AMB_A_Mohammed: The PICI is chaired by South African President Jacob Zuma,UNRELATED
"CS Raychelle Omamo, Thursday bid farewell to H.E.@ajardfelt, Outgoing Ambassador of Sweden to Kenya in a virtual ceremony. The CS thanked the ambassador for the bilateral gains made during her five-year tenure in Kenya which include trade, health, transport, women Empowerment.",UNRELATED
Capt. Langat was released following high-level negotiations spearheaded by CS @amb_A_Mohammed with Govt of South Sudan. 2/4,UNRELATED
"H.E.@UKenyatta: We continue our mission in Somalia. If we fight the enemy in Somalia, we won’t have to fight them here at home #SONAKE2017",UNRELATED
"CS Amb Raychelle Omamo today held bilateral talks with H.E. Sabri Boukadoum, Minister of Foreign Affairs of Algeria who is on a two day visit to Kenya. They discussed how to strengthen ties, committed to a Joint Commission for Cooperation (JCC) and finalize on MOUs signed.",RECEIVE
"CS @Amb_Amina4AUC: Accompanied by my colleague CS Hon Najib Balala, we arrived in Luanda, Angola; We were received by Amb.Josphat Maikara",AWAY
CS @AMB_A_Mohammed: Thanked Egypt for donating a Dialysis Unit &amp; Liver Binoculars to the Kenyatta National Hospital,UNRELATED
"Ms. Donna Celestial, Philippines' Deputy PR to UNEP &amp; HABITAT, signs condolence book @ForeignOfficeKE. #GarissaAttack",UNRELATED
CS @AMB_A_Mohammed: We discussed and agreed to continue working together on issues of common interests between Kenya and Ethiopia.,UNRELATED
Message of Condolence and Solidarity to the Federal Government of Somalia.,UNRELATED
Heads of States from IGAD are still holding consultations with South Sudan leaders on IGAD-plus Compromise Agreement on peace for S.Sudan,UNRELATED
CS #MonicaJuma held bilateral talks with Pakistani Foreign Secretary Tehmina Janjua at Pakistan Foreign Affairs offices. They discussed ways of enhancing bilateral relations between the two countries and urgently review and refocus  JMC which last met in 2004.,AWAY
"Yesterday evening, CAS Ababu Namwamba received a Memorandum from South Sudanese Youth Leaders adopted in Kigali last week titled 'Youth Position on Outstanding Issues Regarding the High-Level Revitalization Forum on South Sudan.' The delegation was led by Dr Koiti Emmily.",UNRELATED
CS @AMB_A_Mohammed: The Session reviewed the situation in Somalia &amp; South Sudan &amp; deliberated on the way forward,UNRELATED
"Japanese Government Finance Director, Koji Yonetani, Calls on PS Kibicho ",UNRELATED
Kenya expressed support of Uganda's bid to host AGOA summit in 2017 and inclusion to the bureau.,UNRELATED
